{
  "$schema": "https://architecture-kit.invalid/schemas/harness-tools.schema.json",
  "version": 1,
  "reviewed_on": "2026-10-04",
  "scope": "Architecture/interface guidance, selected implementation excerpts and test definitions; whole-file byte receipts do not imply full source audit or runtime acceptance.",
  "collection_files": {
    "README.md": "27e66ae1f7f78be5ab533f49fca86e0a2af4d223b7c2b59e414f24c2339b1b84"
  },
  "sources": [
    {
      "id": "architecture-kit",
      "checkout": "public/architecture-kit",
      "role": "kit",
      "purpose": "Portable specifications and local verification.",
      "observation": "This repository contains contracts and synthetic validators, not an implemented agent platform.",
      "files": {}
    },
    {
      "id": "ascii-designer-mcp",
      "checkout": "public/ascii-designer-mcp",
      "role": "tool",
      "purpose": "CLI/MCP ASCII rendering pipeline.",
      "observation": "Cheap frame previews precede costly render jobs; job status, cancellation and seam measurements are explicit.",
      "files": {
        "README.md": "407a348bd8c4d2f659fbc26e36c76db084eeeb155b3bbd218b8d06894bb1b614",
        ".project-checks.json": "b606fea8be513f44e5ca025846777056e3b39b628b9a67372aa3f55bf26706c3",
        "src/ascii_designer/jobs.py": "4348afaa2c35cc7ca7a4661383c98cbf83fe43f9c2b458fdcdbb0760f7fcfd9e",
        "tests/integration/test_mcp.py": "e0f418955d72ef70044f735caeb9c22814181b1069f408d8e079b74d5dce229f"
      }
    },
    {
      "id": "ast-index-nix",
      "checkout": "public/ast-index-nix",
      "role": "tool",
      "purpose": "Local-first AST index with CLI and MCP adapters.",
      "observation": "One shared library serves CLI, stdio and socket views; name-resolved edges have explicit precision limits.",
      "files": {
        "README.md": "b762e9cc681f93955ca738a7f6b660e5a2ac3c7d07c8963a62713957cd00d714",
        ".project-checks.json": "4d13b5ca28110321cd987afa4fce6ea7d2ceea12a00714eca296d3f59bf83088",
        "src/resolve.rs": "f2daf7621d35d8a5c60e84f5e2a7fa705cdf9b8f4c324d87c5c5c95b8b19dd72",
        "tests/integration.rs": "584df330bad55c6885465e7fdd8808e50050fa2db78f699edbf69b8641a073b9"
      }
    },
    {
      "id": "project-check-nix",
      "checkout": "public/project-check-nix",
      "role": "tool",
      "purpose": "Declared argv verification and dependency documentation.",
      "observation": "Plans inspect prerequisites without running commands; opted-in documentation renders from explicit source data.",
      "files": {
        "README.md": "5ae30b3ba00f09ce063e3099453de9f55ac0e0a8aa6ad8009f5454ad574a000d",
        ".project-checks.json": "41e1665fe4dadf447abbc2ebb284b3bafafb3ff931a8a3288e94fdd6f1772f40",
        "runtime/project_docs.py": "792299a25cb17e8fee2bdb7514f3d76c2cbd4a6f9cd375b8e30a185962d42c15",
        "runtime/project_check.py": "fac03cb56b60d78ee21669bbce312c69acecc5dc29c43e4491389ee2b9aa36c5",
        "tests/test_project_docs.py": "db93d0bb42a5340eece7e5166ee5fe8a07718ee6a12946e231e82930be6e22d0"
      }
    },
    {
      "id": "public-agents-files",
      "checkout": "public/public-agents-files",
      "role": "mirror",
      "purpose": "Allowlisted public skills and tool mirrors.",
      "observation": "Exported tracked content has exact source revisions and digests; mirrors do not become standalone development sources.",
      "files": {
        "README.md": "43a1e89366e463b68467c05ffcd7d7667745b89828cf9178f71bbb2094c6d3f7",
        "scripts/public_tool_rules.json": "81e72721f9decc54af19c5b59e21a8fe25998224cdc65ef32f88b5b245076e60"
      }
    },
    {
      "id": "system-health-nix",
      "checkout": "public/system-health-nix",
      "role": "tool",
      "purpose": "Interval host metrics and private aggregate history.",
      "observation": "Measurements identify workload pressure without retaining argv or identity; unavailable metrics remain unavailable.",
      "files": {
        "README.md": "6856c380d87cf9de3e62f626137996869309a3aecb0ccbdf962eb3f741a46018",
        ".project-checks.json": "839654210c826bae3b2eb61373fd633a066f4c0e1516bbb8770871d9101fdf62",
        "nix/package.nix": "db18060d9d58d1ce492df2db2f8d4d27712efc500c2d6ce660481a944eddbc63",
        "tests/system-health.sh": "e9ec420678956f00100ae1ab93883f44531c33697b56954be3b307ba4b71930d"
      }
    },
    {
      "id": "visual-qa-mcp",
      "checkout": "public/visual-qa-mcp",
      "role": "tool",
      "purpose": "Evidence-backed visual QA through CLI and MCP.",
      "observation": "A shared service targets rechecks at recorded findings; browser skips and explicit baseline approval limit claims.",
      "files": {
        "README.md": "29d95aae123fd9dd46bfc04aba24b63d45531a5d4930a8d7323d8bb1c163aafa",
        ".project-checks.json": "5b4d1db940c8f53b4fd5eb6f67d6b1e47a633571dc0b60fa8e20607a6eb1e0ab",
        "src/service.ts": "aa4bfac314bef5d535a82575f32696969e524d92e662fde52a8c286f264fe711",
        "tests/README.md": "ddfa7043e2e83781cf4c8dcdb26cd9d14f56d4338fa269cd16bc96c5132130e8"
      }
    },
    {
      "id": "agent-evidence-nix",
      "checkout": "private/agent-evidence-nix",
      "role": "tool",
      "purpose": "Bounded source-bound reads, search and diff.",
      "observation": "File and result-generation guards reject stale pages; search and tracked diff declare distinct corpora.",
      "files": {
        "README.md": "a20f7ac9ad6cf2d2a793e628b4864121deced897abe539ba50f337c7ef12f16f",
        ".project-checks.json": "436f7b99e87848bf5ae01c688b83933bf5088a096db12e16760a73ee3fe2835f",
        "src/agent_evidence/source.py": "63b5ccce32f912d5327cf96348b21946b4555c785e50902787d3c44a4d20156e",
        "src/agent_evidence/selection.py": "548764171bba4a550e972a34e2ec2ac68f0fffe804bad003b1ea27cc9d639cb9",
        "tests/test_evidence.py": "e8d2596701fd3bd52e92b1650096c12a53d44aa08dc3b3dcb6fe015e8c5b415b"
      }
    },
    {
      "id": "agent-runtime-nix",
      "checkout": "private/agent-runtime-nix",
      "role": "tool",
      "purpose": "Separate-account runtime and offline builder.",
      "observation": "Host-selected packages and explicit operator configuration keep runtime integration independent of package repositories.",
      "files": {
        "README.md": "7b1172d625fdd74eb52291e6ccb603fc83ecab706462c1f9e5b2bcf11e39074d",
        ".project-checks.json": "19e163fb5d9cb9415418b2fcec35644047f359689d2a49c701ce12fdd00dea50",
        "docs/modularity.md": "4842c7740e327689d5539f5524172eaf03ed7059b9252c4b03485e4c19040548"
      }
    },
    {
      "id": "agent-security-scan-nix",
      "checkout": "private/agent-security-scan-nix",
      "role": "tool",
      "purpose": "Pinned source, privacy and dependency scanning.",
      "observation": "Current-file privacy, history privacy and meaningful scanner coverage are distinct claims; diagnostics omit matched content.",
      "files": {
        "README.md": "57f6f1ada79148490f78e2967f53f4dfd6605ca1c44ec081d2ab783bb2593423",
        ".project-checks.json": "7b8e1488b12a3d5dcee013754a4eb0228372e4a2d33c342e032eeb9222b7df63",
        "tests/test_privacy.py": "10ce343b032f9404afa826322deff3a534d3fd276ea8c4efa01f382f022fbf0b"
      }
    },
    {
      "id": "agent-tool-meter-nix",
      "checkout": "private/agent-tool-meter-nix",
      "role": "tool",
      "purpose": "Private command-volume and latency measurements.",
      "observation": "Measurement logs omit argv/output contents; lock waits, slow output consumers and descendant cleanup are bounded.",
      "files": {
        "README.md": "cd07dd9b1e8d898a7af33fdf487422651a534f9f781d7474b3fc93996ca7b665",
        ".project-checks.json": "16d8a7dfc501567d2f244ff2fab4e838a2bc60a98cd3cb09d2c19dd08c85ca79",
        "src/agent_tool_meter/meter.py": "7f1ead8fc2930e356881b90b14df0882fb708cbf0b7d86a246434e9893cacd9d",
        "tests/test_meter.py": "0d82320c0429d572ef1164a5bf2d35e84d908865505c2b0ecd5ec0bd6a93b7d1"
      }
    },
    {
      "id": "agent-toolbox-nix",
      "checkout": "private/agent-toolbox-nix",
      "role": "tool",
      "purpose": "Pinned command environment with a stable argv wrapper.",
      "observation": "Selected commands and descendants use the chosen tool PATH; this composition grants no sandbox or extra authority.",
      "files": {
        "README.md": "ef122856776add1342b4bd91801036db6cd6ac42d31709ac7cafafa49c322e96",
        ".project-checks.json": "be832223fcad04b7e63fd327dffb0c63cdd0a5081ba80a5403816c122732b884",
        "nix/toolbox.nix": "8f3d2c77a65865433c842a8d2ad3066dbdaf0bf7dac1fc3dc01d7a5bd846e601"
      }
    },
    {
      "id": "coding-agents-nix",
      "checkout": "private/coding-agents-nix",
      "role": "tool",
      "purpose": "Pinned native harness packages and optional configuration.",
      "observation": "Package pins own versions; instruction delivery and native usage counters do not establish paired coding-task quality.",
      "files": {
        "README.md": "d8168018086f3f6ab98d262de81ffadc84325236f1ffa9a8bf99baa581d30d34",
        ".project-checks.json": "f2da262e5c2e02b4af7c2bd73fd01bd9b54c422b4487a81d5d80734e36375506",
        "docs/harness-quality.md": "3826cdec6777331add6de82e3b37658b710878c762d8a9fb94be28e9bf4d9041",
        "runtime/session-report.mjs": "2508cdbee1ba675427fb06d4302d894b936acf48582b63f5d3a9eb99bda38459"
      }
    },
    {
      "id": "desicion-testing-nix",
      "checkout": "private/desicion-testing-nix",
      "role": "empty",
      "purpose": "Reserved empty directory.",
      "observation": "No source or product evidence was present at review.",
      "files": {}
    },
    {
      "id": "library-pkgs-knowledge",
      "checkout": "private/library-pkgs-knowledge",
      "role": "empty",
      "purpose": "Reserved empty directory.",
      "observation": "No source or product evidence was present at review.",
      "files": {}
    },
    {
      "id": "lite-runtime-nix",
      "checkout": "private/lite-runtime-nix",
      "role": "tool",